source,title,link,published,collected_date
TechCrunch,How I Get Free Traffic from ChatGPT in 2025 (AIO vs SEO),https://techncruncher.blogspot.com/2025/12/how-i-get-free-traffic-from-chatgpt-in.html,"Thu, 04 Dec 2025 05:37:00 +0000",2026-04-03
TechCrunch,Top 10 AI Tools That Will Transform Your Content Creation in 2025,https://techncruncher.blogspot.com/2025/01/top-10-ai-tools-that-will-transform.html,"Thu, 02 Jan 2025 09:26:00 +0000",2026-04-03
TechCrunch,"LimeWire AI Studio Review 2023: Details, Pricing & Features",https://techncruncher.blogspot.com/2023/12/limewire-ai-studio-review-2023-details.html,"Tue, 12 Dec 2023 16:10:00 +0000",2026-04-03
TechCrunch,Top 10 AI Tools in 2023 That Will Make Your Life Easier,https://techncruncher.blogspot.com/2023/01/top-10-ai-tools-in-2023-that-will-make.html,"Wed, 25 Jan 2023 19:52:00 +0000",2026-04-03
TechCrunch,Top 10 AI Content Generator & Writer Tools in 2022,https://techncruncher.blogspot.com/2022/11/top-10-ai-content-generator-writer.html,"Tue, 15 Nov 2022 08:58:00 +0000",2026-04-03
Ars Technica,Four astronauts are now inexorably bound for the Moon,https://arstechnica.com/space/2026/04/four-astronauts-are-now-inexorably-bound-for-the-moon/,"Fri, 03 Apr 2026 02:17:37 +0000",2026-04-03
Ars Technica,"Perplexity's ""Incognito Mode"" is a ""sham,"" lawsuit says",https://arstechnica.com/tech-policy/2026/04/perplexitys-incognito-mode-is-a-sham-lawsuit-says/,"Thu, 02 Apr 2026 20:54:02 +0000",2026-04-03
Ars Technica,SpaceX tries to convince FCC that Amazon put satellites into wrong altitude,https://arstechnica.com/tech-policy/2026/04/spacex-claims-amazon-leo-launches-could-crash-into-starlink-satellites/,"Thu, 02 Apr 2026 20:32:05 +0000",2026-04-03
Ars Technica,"Google Vids gets AI upgrade with Veo and Lyria models, directable AI avatars",https://arstechnica.com/ai/2026/04/google-vids-gets-ai-upgrade-with-veo-and-lyria-models-directable-ai-avatars/,"Thu, 02 Apr 2026 19:58:37 +0000",2026-04-03
Ars Technica,Male octopuses guided through mating by female hormones,https://arstechnica.com/science/2026/04/male-octopuses-guided-through-mating-by-female-hormones/,"Thu, 02 Apr 2026 19:48:16 +0000",2026-04-03
The Verge,AO3 is finally out of beta after 17 years,https://www.theverge.com/tech/906346/ao3-archive-of-our-own-beta-exit,2026-04-02T18:07:58-04:00,2026-04-03
The Verge,PSA: Anyone with a link can view your Granola notes by default,https://www.theverge.com/ai-artificial-intelligence/906253/granola-note-links-ai-training-psa,2026-04-02T17:56:16-04:00,2026-04-03
The Verge,Reddit is moving on from r/all,https://www.theverge.com/tech/906314/reddit-r-all-deprecating,2026-04-02T17:50:53-04:00,2026-04-03
The Verge,The best AirPods deals you can get right now,https://www.theverge.com/21302051/best-apple-airpods-deals,2026-04-02T17:19:13-04:00,2026-04-03
The Verge,This bike rack pioneer is selling Bluetooth suction cups to stick bikes to your car,https://www.theverge.com/gadgets/906076/allen-smart-suction-go-bike-rack,2026-04-02T16:05:02-04:00,2026-04-03
BBC World,Artemis II blasts ever closer to the far side of the Moon,https://www.bbc.com/news/articles/c937g7nd5x4o?at_medium=RSS&at_campaign=rss,"Fri, 03 Apr 2026 03:35:28 GMT",2026-04-03
BBC World,Trump removes US Attorney General Pam Bondi,https://www.bbc.com/news/articles/ce843ge47z4o?at_medium=RSS&at_campaign=rss,"Fri, 03 Apr 2026 00:31:27 GMT",2026-04-03
BBC World,'I haven't slept for days': Iranians describe mounting desperation after a month of war,https://www.bbc.com/news/articles/crm1vj941x9o?at_medium=RSS&at_campaign=rss,"Thu, 02 Apr 2026 16:09:24 GMT",2026-04-03
BBC World,Fears cost of water and beer to soar as India's scorching summer hits,https://www.bbc.com/news/articles/c5ywqky5dd7o?at_medium=RSS&at_campaign=rss,"Thu, 02 Apr 2026 23:16:37 GMT",2026-04-03
BBC World,'Be serious... don't speak every day': Macron criticises Trump approach to Iran war,https://www.bbc.com/news/articles/cevk0e4ykwko?at_medium=RSS&at_campaign=rss,"Thu, 02 Apr 2026 13:41:27 GMT",2026-04-03
BBC Technology,"Fewer UK adults posting on social media, Ofcom finds",https://www.bbc.com/news/articles/cgqk718l4neo?at_medium=RSS&at_campaign=rss,"Thu, 02 Apr 2026 14:38:24 GMT",2026-04-03
BBC Technology,Elon Musk's SpaceX set to be worth $1 trillion with planned public listing,https://www.bbc.com/news/articles/c2k35lg92dpo?at_medium=RSS&at_campaign=rss,"Thu, 02 Apr 2026 07:05:05 GMT",2026-04-03
BBC Technology,Peppa Pig and Transformers owner Hasbro hit by cyber-attack,https://www.bbc.com/news/articles/cx24e1nryn9o?at_medium=RSS&at_campaign=rss,"Wed, 01 Apr 2026 16:05:37 GMT",2026-04-03
BBC Technology,Claude Code users hitting usage limits 'way faster than expected',https://www.bbc.com/news/articles/ce8l2q5yq51o?at_medium=RSS&at_campaign=rss,"Wed, 01 Apr 2026 11:59:19 GMT",2026-04-03
BBC Technology,Mass robotaxi malfunction halts traffic in Chinese city,https://www.bbc.com/news/articles/cvge91r9j80o?at_medium=RSS&at_campaign=rss,"Wed, 01 Apr 2026 11:34:31 GMT",2026-04-03
Bloomberg,"Middle East Conflict Weighs on Global Food Prices, FAO Says",https://www.bloomberg.com/news/articles/2026-04-03/middle-east-conflict-weighs-on-global-food-prices-fao-says,"Fri, 03 Apr 2026 08:14:58 GMT",2026-04-03
Bloomberg,Iran Strikes More Gulf Targets as Trump Warns of Further Attacks,https://www.bloomberg.com/news/articles/2026-04-03/iran-strikes-more-gulf-targets-as-trump-warns-of-further-attacks,"Fri, 03 Apr 2026 08:35:23 GMT",2026-04-03
Bloomberg,French-Owned Container Ship Exits Hormuz in First Since War,https://www.bloomberg.com/news/articles/2026-04-03/french-owned-container-ship-exits-hormuz-in-first-since-iran-war,"Fri, 03 Apr 2026 07:24:11 GMT",2026-04-03
Bloomberg,France Weighs Targeted Fuel Aid as Pump Costs Jump on Iran War,https://www.bloomberg.com/news/articles/2026-04-03/france-weighs-targeted-fuel-aid-as-pump-costs-jump-on-iran-war,"Fri, 03 Apr 2026 08:10:06 GMT",2026-04-03
Bloomberg,Italy Extends Iran War Fuel-Tax Cut at Cost of €500 Million,https://www.bloomberg.com/news/articles/2026-04-03/italy-extends-iran-war-fuel-tax-cut-at-cost-of-500-million,"Fri, 03 Apr 2026 08:05:25 GMT",2026-04-03
Financial Times,"Europe must prepare for ‘long-lasting’ energy shock, EU warns",https://www.ft.com/content/7d3a6810-b571-4730-aa35-f7bfcacdc242,"Fri, 03 Apr 2026 04:00:32 GMT",2026-04-03
Financial Times,Prediction markets: the hunt for the new ‘dumb money’,https://www.ft.com/content/9b038375-66c1-4c30-80a3-49176e5137dd,"Fri, 03 Apr 2026 04:00:12 GMT",2026-04-03
Financial Times,"Inside Tehran, a city under attack",https://www.ft.com/content/f5e9f184-50bf-466e-8f43-09c7321d0598,"Fri, 03 Apr 2026 04:00:22 GMT",2026-04-03
Financial Times,What’s going on with dollar debt?,https://www.ft.com/content/c5a34c74-416c-4c90-8fc3-60a1c94d7cd5,"Fri, 03 Apr 2026 04:00:32 GMT",2026-04-03
Financial Times,Trump fires US attorney-general Pam Bondi,https://www.ft.com/content/533ecec7-713f-46f1-a2a2-cbd9a659299f,"Thu, 02 Apr 2026 19:41:43 GMT",2026-04-03
ESPN NBA,Luka (hamstring) set for MRI after exiting loss,https://www.espn.com/nba/story/_/id/48382849/luka-doncic-exits-lakers-game-okc-hamstring-strain,"Thu, 2 Apr 2026 23:48:54 EST",2026-04-03
ESPN NBA,"Spurs rest Wemby on back-to-back, top Clippers",https://www.espn.com/nba/story/_/id/48380360/spurs-rule-victor-wembanyama-ankle-clippers,"Thu, 2 Apr 2026 23:48:54 EST",2026-04-03
ESPN NBA,"Edwards (sick) sits, now ineligible for NBA awards",https://www.espn.com/nba/story/_/id/48381324/timberwolves-rest-anthony-edwards-vs-pistons-manage-knee-pain,"Thu, 2 Apr 2026 23:48:54 EST",2026-04-03
ESPN NBA,Pistons' Cunningham out at least another week,https://www.espn.com/nba/story/_/id/48378921/pistons-cunningham-collapsed-lung-least-another-week,"Thu, 2 Apr 2026 23:48:54 EST",2026-04-03
ESPN NBA,Blazers' new owner urging shift to bigger goals,https://www.espn.com/nba/story/_/id/48381848/blazers-dundon-more-aggressive-urges-bigger-goals,"Thu, 2 Apr 2026 23:48:54 EST",2026-04-03
Sky Sports,"MacIntyre, Fleetwood in early contention at Texas Open",https://www.skysports.com/golf/news/12040/13527447/valero-texas-open-robert-macintyre-and-tommy-fleetwood-in-early-contention-after-first-round-oaks-course,"Fri, 03 Apr 2026 07:03:00 BST",2026-04-03
Sky Sports,Haas boss Komatsu warns against knee-jerk F1 changes despite Bearman crash,https://www.skysports.com/f1/news/12040/13526954/f1-2026-haas-boss-ayao-komatsu-warns-against-knee-jerk-changes-to-rules-despite-oliver-bearmans-suzuka-crash,"Fri, 03 Apr 2026 07:00:00 BST",2026-04-03
Sky Sports,'What has gone on there!?' | Littler fumes at Van Veen in heated climax!,https://www.skysports.com/watch/video/13527391/premier-league-darts-manchester-luke-littler-and-van-veen-get-heated-in-final-leg,"Thu, 02 Apr 2026 20:41:00 BST",2026-04-03
Sky Sports,"Kim, Korda one shot off lead after tight Aramco Championship first round",https://www.skysports.com/golf/news/12040/13527453/aramco-championship-hyo-joo-kim-nelly-korda-one-shot-off-lead-after-first-round-of-lpga-tour-event,"Fri, 03 Apr 2026 07:35:00 BST",2026-04-03
Sky Sports,Harper: Dubois panicked - she didn't know what to do,https://www.skysports.com/boxing/news/12040/13527320/terri-harper-believes-caroline-dubois-panicked-after-push-she-didnt-know-what-to-do-she-was-off-script,"Fri, 03 Apr 2026 07:00:00 BST",2026-04-03
MIT Tech Review,"The Download: plastic’s problem with fuel prices, and SpaceX’s blockbuster IPO",https://www.technologyreview.com/2026/04/02/1135049/the-download-plastic-problem-fuel-prices-spacex-ipo/,"Thu, 02 Apr 2026 12:10:00 +0000",2026-04-03
MIT Tech Review,Fuel prices are soaring. Plastic could be next.,https://www.technologyreview.com/2026/04/02/1135045/plastic-economic-effects/,"Thu, 02 Apr 2026 10:00:00 +0000",2026-04-03
MIT Tech Review,"The Download: gig workers training humanoids, and better AI benchmarks",https://www.technologyreview.com/2026/04/01/1134993/the-download-gig-workers-training-humanoids-better-ai-benchmarks/,"Wed, 01 Apr 2026 12:10:00 +0000",2026-04-03
MIT Tech Review,The gig workers who are training humanoid robots at home,https://www.technologyreview.com/2026/04/01/1134863/humanoid-data-training-gig-economy-2026-breakthrough-technology/,"Wed, 01 Apr 2026 11:00:00 +0000",2026-04-03
MIT Tech Review,Shifting to AI model customization is an architectural imperative,https://www.technologyreview.com/2026/03/31/1134762/shifting-to-ai-model-customization-is-an-architectural-imperative/,"Tue, 31 Mar 2026 14:12:50 +0000",2026-04-03
Wired,$20 Chewy Promo Code | April 2026,https://www.wired.com/story/chewy-promo-code/,"Fri, 03 Apr 2026 05:00:00 +0000",2026-04-03
Wired,50% Off Home Depot Promo Codes | April 2026,https://www.wired.com/story/home-depot-promo-code/,"Fri, 03 Apr 2026 05:00:00 +0000",2026-04-03
Wired,50% Off DoorDash Promo Code | April 2026,https://www.wired.com/story/doordash-promo-code/,"Fri, 03 Apr 2026 05:00:00 +0000",2026-04-03
Wired,HelloFresh Coupon Codes: 55% Off + Free Meals,https://www.wired.com/story/hellofresh-coupon/,"Fri, 03 Apr 2026 05:00:00 +0000",2026-04-03
Wired,Booking.com Promo Codes and Deals: Up to 20% Off,https://www.wired.com/story/booking-com-promo-code/,"Fri, 03 Apr 2026 05:00:00 +0000",2026-04-03
PC Gamer,"A former GameStop exec thought building its Steam competitor would be his 'forever job,' but the retailer bet the house on digital distribution being 'a passing phase'",https://www.pcgamer.com/gaming-industry/a-former-gamestop-exec-thought-building-its-steam-competitor-would-be-his-forever-job-but-the-retailer-bet-the-house-on-digital-distribution-being-a-passing-phase/,"Thu, 02 Apr 2026 22:35:10 +0000",2026-04-03
PC Gamer,Mega Crit co-founder says he wasn't bothered by the Steam backlash to Slay the Spire 2's beta balance patch: 'It's difficult for players to feel like they're heard',https://www.pcgamer.com/games/card-games/mega-crit-co-founder-says-he-wasnt-bothered-by-the-steam-backlash-to-slay-the-spire-2s-beta-balance-patch-its-difficult-for-players-to-feel-like-theyre-heard/,"Thu, 02 Apr 2026 22:06:52 +0000",2026-04-03
PC Gamer,"The Emperor Protects: A Warhammer 40,000 Musical is a deeply committed April Fool's joke from Games Workshop, and I don't care if it's a day late because it's just that good",https://www.pcgamer.com/games/the-emperor-protects-a-warhammer-40-000-musical-is-a-deeply-committed-april-fools-joke-from-games-workshop-and-i-dont-care-if-its-a-day-late-because-its-just-that-good/,"Thu, 02 Apr 2026 22:06:49 +0000",2026-04-03
PC Gamer,Revisiting the last truly great Call of Duty,https://www.pcgamer.com/games/call-of-duty/revisiting-the-last-truly-great-call-of-duty/,"Thu, 02 Apr 2026 21:49:23 +0000",2026-04-03
PC Gamer,"43% of you have, or will be switching to gaming on Linux this year, but more surprising than that over a quarter of you actually don't mind Windows",https://www.pcgamer.com/software/operating-systems/43-percent-of-you-have-or-will-be-switching-to-gaming-on-linux-this-year-but-more-surprising-than-that-over-a-quarter-of-you-actually-dont-mind-windows/,"Thu, 02 Apr 2026 20:18:23 +0000",2026-04-03
IGN,"The Rugged, Waterproof JI Osmo Action 4 Action Camera Can Record at 4K and 120fps for Just $199",https://www.ign.com/articles/best-action-camera-deal-in-april-2026,"Thu, 2 Apr 2026 22:35:00 +0000",2026-04-03
IGN,'We’re Not Going to do a Dead by Daylight 2' – Developer Kills Possibility of a Sequel,https://www.ign.com/articles/were-not-going-to-do-a-dead-by-daylight-2-developer-kills-possibility-of-a-sequel,"Thu, 2 Apr 2026 22:31:22 +0000",2026-04-03
IGN,One Deranged Pokémon Pokopia Player Has Slurped Up the Entire Ocean,https://www.ign.com/articles/one-deranged-pokmon-pokopia-player-has-slurped-up-the-entire-ocean,"Thu, 2 Apr 2026 22:19:12 +0000",2026-04-03
IGN,The FlashForge AD5X Is One of the Best Multi-Color 3D Printers Under $300,https://www.ign.com/articles/flashforge-ad5x-corexy-multi-color-3d-printer-deal-aliexpress-april-sale,"Thu, 2 Apr 2026 21:55:00 +0000",2026-04-03
IGN,"Dell Has the Cheapest 32"" 4K OLED Gaming Monitor With This $300 Discount",https://www.ign.com/articles/dell-s3225qc-4k-oled-gaming-monitor-deal-in-april,"Thu, 2 Apr 2026 21:35:00 +0000",2026-04-03
TechCrunch,How I Get Free Traffic from ChatGPT in 2025 (AIO vs SEO),https://techncruncher.blogspot.com/2025/12/how-i-get-free-traffic-from-chatgpt-in.html,"Thu, 04 Dec 2025 05:37:00 +0000",2026-04-07
TechCrunch,Top 10 AI Tools That Will Transform Your Content Creation in 2025,https://techncruncher.blogspot.com/2025/01/top-10-ai-tools-that-will-transform.html,"Thu, 02 Jan 2025 09:26:00 +0000",2026-04-07
TechCrunch,"LimeWire AI Studio Review 2023: Details, Pricing & Features",https://techncruncher.blogspot.com/2023/12/limewire-ai-studio-review-2023-details.html,"Tue, 12 Dec 2023 16:10:00 +0000",2026-04-07
TechCrunch,Top 10 AI Tools in 2023 That Will Make Your Life Easier,https://techncruncher.blogspot.com/2023/01/top-10-ai-tools-in-2023-that-will-make.html,"Wed, 25 Jan 2023 19:52:00 +0000",2026-04-07
TechCrunch,Top 10 AI Content Generator & Writer Tools in 2022,https://techncruncher.blogspot.com/2022/11/top-10-ai-content-generator-writer.html,"Tue, 15 Nov 2022 08:58:00 +0000",2026-04-07
Ars Technica,"Astronauts set distance record, revealing the Moon as a place to be explored",https://arstechnica.com/space/2026/04/astronauts-set-distance-record-revealing-the-moon-as-a-place-to-be-explored/,"Tue, 07 Apr 2026 03:50:32 +0000",2026-04-07
Ars Technica,"After court loss, RFK Jr. gives himself more power over CDC vaccine panel",https://arstechnica.com/health/2026/04/after-court-loss-rfk-jr-gives-himself-more-power-over-cdc-vaccine-panel/,"Mon, 06 Apr 2026 22:34:11 +0000",2026-04-07
Ars Technica,"From folding boxes to fixing vacuums, GEN-1 robotics model hits 99% reliability",https://arstechnica.com/ai/2026/04/generalists-new-physical-robotics-ai-brings-production-level-success-rates/,"Mon, 06 Apr 2026 22:18:33 +0000",2026-04-07
Ars Technica,"Sports bets on prediction markets ruled to be ""swaps,"" exempt from state laws",https://arstechnica.com/tech-policy/2026/04/sports-bets-on-prediction-markets-ruled-to-be-swaps-exempt-from-state-laws/,"Mon, 06 Apr 2026 21:56:36 +0000",2026-04-07
Ars Technica,Trump's next budget once again calls for massive cuts to science,https://arstechnica.com/science/2026/04/trumps-next-budget-once-again-calls-for-massive-cuts-to-science/,"Mon, 06 Apr 2026 21:40:40 +0000",2026-04-07
The Verge,Wisconsin governor says ‘no’ to age checks for porn,https://www.theverge.com/policy/907761/wisconsin-governor-porn-age-verification-vetoed,2026-04-06T17:47:15-04:00,2026-04-07
The Verge,"Artemis II astronauts break a record, name a crater",https://www.theverge.com/science/907682/nasa-artemis-ii-distance-record-crater-names,2026-04-06T16:40:11-04:00,2026-04-07
The Verge,The best deals on MacBooks right now,https://www.theverge.com/22399419/apple-macbook-air-pro-mac-mini-imac-deals,2026-04-06T14:50:06-04:00,2026-04-07
The Verge,"DJI’s Mic Mini records clear audio on the go, and it&#8217;s on sale for $60",https://www.theverge.com/gadgets/907582/dji-mic-mini-two-transmitters-deal-sale,2026-04-06T14:22:01-04:00,2026-04-07
The Verge,Robotaxi companies won’t say how often remote operators intervene,https://www.theverge.com/transportation/907478/robotaxi-remote-assistance-markey-investigation-waymo-tesla,2026-04-06T14:15:51-04:00,2026-04-07
BBC World,Little sign of breakthrough as Trump's Iran deadline nears,https://www.bbc.com/news/articles/czexw94rj5jo?at_medium=RSS&at_campaign=rss,"Mon, 06 Apr 2026 23:04:23 GMT",2026-04-07
BBC World,Australia's most-decorated living soldier charged over alleged war crimes,https://www.bbc.com/news/articles/crr1jyk0qwjo?at_medium=RSS&at_campaign=rss,"Tue, 07 Apr 2026 07:19:27 GMT",2026-04-07
BBC World,JD Vance due in Hungary to back Orban's re-election bid,https://www.bbc.com/news/articles/cyv16lq2rp1o?at_medium=RSS&at_campaign=rss,"Tue, 07 Apr 2026 01:45:41 GMT",2026-04-07
BBC World,Taiwan opposition leader visits China for expected meeting with Xi Jinping,https://www.bbc.com/news/articles/c0krnz7mmmjo?at_medium=RSS&at_campaign=rss,"Tue, 07 Apr 2026 07:29:55 GMT",2026-04-07
BBC World,Nine policemen sentenced to death in India over Covid custody killings,https://www.bbc.com/news/articles/ce8l0md9gl1o?at_medium=RSS&at_campaign=rss,"Mon, 06 Apr 2026 21:21:13 GMT",2026-04-07
BBC Technology,Businesses scramble to get noticed by AI search,https://www.bbc.com/news/articles/c70n2rjgxeyo?at_medium=RSS&at_campaign=rss,"Mon, 06 Apr 2026 23:20:52 GMT",2026-04-07
BBC Technology,"China is winning one AI race, the US another - but either might pull ahead",https://www.bbc.com/news/articles/c145enxln0go?at_medium=RSS&at_campaign=rss,"Tue, 07 Apr 2026 05:13:12 GMT",2026-04-07
BBC Technology,How China fell for a lobster: What an AI assistant tells us about Beijing's ambition,https://www.bbc.com/news/articles/cy41n17e23go?at_medium=RSS&at_campaign=rss,"Sun, 05 Apr 2026 22:07:40 GMT",2026-04-07
BBC Technology,Apple at 50: Three products that changed how we live - and three that really didn't,https://www.bbc.com/news/articles/ckgxdn9lyd2o?at_medium=RSS&at_campaign=rss,"Sat, 04 Apr 2026 23:56:55 GMT",2026-04-07
BBC Technology,"Power-washing, pool-cleaning and mowing: Why millions are playing games about mundane jobs",https://www.bbc.com/news/articles/cj60r2kdnw1o?at_medium=RSS&at_campaign=rss,"Sat, 04 Apr 2026 00:03:41 GMT",2026-04-07
Bloomberg,Checking Reports of Civilian Injuries in Lebanon (Video),https://www.bloomberg.com/news/videos/2026-04-07/checking-reports-of-civilian-injuries-in-lebanon-video,"Tue, 07 Apr 2026 09:07:03 GMT",2026-04-07
Bloomberg,Oil Erases Gain in Choppy Trading Before Trump’s Iran Deadline,https://www.bloomberg.com/news/articles/2026-04-06/latest-oil-market-news-and-analysis-for-april-7,"Mon, 06 Apr 2026 22:07:26 GMT",2026-04-07
Bloomberg,European Gas Prices Fluctuate Ahead of Trump’s Iran Deadline,https://www.bloomberg.com/news/articles/2026-04-07/european-gas-ticks-higher-as-trump-threatens-iran-war-escalation,"Tue, 07 Apr 2026 06:21:30 GMT",2026-04-07
Bloomberg,Air India CEO Campbell Wilson to Resign Amid Mounting Losses,https://www.bloomberg.com/news/articles/2026-04-07/air-india-ceo-campbell-wilson-to-step-down-amid-mounting-losses,"Tue, 07 Apr 2026 06:42:03 GMT",2026-04-07
Bloomberg,China’s PBOC Keeps Up Gold-Buying Spree as Iran War Dents Prices,https://www.bloomberg.com/news/articles/2026-04-07/china-s-pboc-keeps-up-gold-buying-spree-as-iran-war-dents-prices,"Tue, 07 Apr 2026 08:36:48 GMT",2026-04-07
Financial Times,Bill Ackman’s Pershing offers to buy Universal Music in €55bn deal,https://www.ft.com/content/3322139e-5df5-4a4a-a6d2-ec42ca6a3c4b,"Tue, 07 Apr 2026 07:17:42 GMT",2026-04-07
Financial Times,Europe’s rearmament meets reality: the story of a failed frigate project,https://www.ft.com/content/124c9dfc-18da-49fa-aab5-6389dce833ae,"Tue, 07 Apr 2026 04:00:21 GMT",2026-04-07
Financial Times,The future of global trade won’t depend on the Strait of Hormuz,https://www.ft.com/content/2c895663-16d5-4b7a-8c9b-45204c362c84,"Tue, 07 Apr 2026 04:00:32 GMT",2026-04-07
Financial Times,The internet is deciding what to forget,https://www.ft.com/content/e1c3fd8e-b7c7-4582-a63b-f7b1a2f2bc93,"Tue, 07 Apr 2026 04:00:45 GMT",2026-04-07
Financial Times,Markets on edge as Trump’s deadline for Iran deal looms,https://www.ft.com/content/e49f0110-f07b-4480-9ea4-2b37aab2c906,"Mon, 06 Apr 2026 23:39:42 GMT",2026-04-07
ESPN NBA,Wemby leaves Spurs' victory due to bruised rib,https://www.espn.com/nba/story/_/id/48416021/wembanyama-exits-spurs-game-vs-76ers-bruised-rib,"Tue, 7 Apr 2026 00:53:20 EST",2026-04-07
ESPN NBA,Grizzlies tie NBA mark for 3s with 29 but still lose,https://www.espn.com/nba/story/_/id/48416352/grizzlies-tie-record-most-3s-made-29-lose-cavaliers,"Tue, 7 Apr 2026 00:53:20 EST",2026-04-07
ESPN NBA,"Bulls fire Karnisovas, GM Eversley after 6 seasons",https://www.espn.com/nba/story/_/id/48413577/sources-bulls-fire-vp-arturas-karnisovas-gm-marc-eversley,"Tue, 7 Apr 2026 00:53:20 EST",2026-04-07
ESPN NBA,Jokic rallies Nuggets as Denver moves to 3 seed,https://www.espn.com/nba/story/_/id/48417190/jokic-rallies-nuggets-vs-blazers-move-denver-3-seed,"Tue, 7 Apr 2026 00:53:20 EST",2026-04-07
ESPN NBA,Pistons' Cunningham nearing return from injury,https://www.espn.com/nba/story/_/id/48414009/pistons-cade-cunningham-nearing-return-collapsed-lung,"Tue, 7 Apr 2026 00:53:20 EST",2026-04-07
Sky Sports,Maguire signs new Man Utd contract,https://www.skysports.com/football/news/12040/13525206/harry-maguire-manchester-united-defender-signs-new-one-year-contract-at-old-trafford,"Tue, 07 Apr 2026 10:00:00 BST",2026-04-07
Sky Sports,Cartwright to leave Hull FC at end of season,https://www.skysports.com/rugby-league/news/12040/13528825/hull-fc-head-coach-john-cartwright-to-leave-super-league-club-at-end-of-season,"Tue, 07 Apr 2026 09:22:00 BST",2026-04-07
Sky Sports,Lawes to join Sale Sharks as he opens door for England return,https://www.skysports.com/rugby-union/news/12040/13528733/courtney-lawes-to-join-sale-sharks-as-he-states-his-england-ambition-im-officially-coming-out-of-international-retirement,"Tue, 07 Apr 2026 08:00:00 BST",2026-04-07
Sky Sports,Today on Sky Sports Racing: My Highness makes Deauville return,https://www.skysports.com/racing/news/12040/13528435/today-on-sky-sports-racing-action-from-southwell-and-deauville-as-my-highness-makes-three-year-old-debut,"Tue, 07 Apr 2026 07:00:00 BST",2026-04-07
Sky Sports,"'Breaking records, smashing ceilings' - Will Red Roses make more history at Six Nations?",https://www.skysports.com/watch/video/13527554/six-nations-englands-sadia-kabeya-and-marlie-packer-read-to-make-more-history-with-red-roses-at-6n,"Fri, 03 Apr 2026 13:45:00 BST",2026-04-07
MIT Tech Review,The one piece of data that could actually shed light on your job and AI,https://www.technologyreview.com/2026/04/06/1135187/the-one-piece-of-data-that-could-actually-shed-light-on-your-job-and-ai/,"Mon, 06 Apr 2026 16:33:35 +0000",2026-04-07
MIT Tech Review,AI is changing how small online sellers decide what to make,https://www.technologyreview.com/2026/04/06/1135118/ai-online-seller-alibaba-accio/,"Mon, 06 Apr 2026 11:00:00 +0000",2026-04-07
MIT Tech Review,Four things we’d need to put data centers in space,https://www.technologyreview.com/2026/04/03/1135073/four-things-wed-need-to-put-data-centers-in-space/,"Fri, 03 Apr 2026 17:03:19 +0000",2026-04-07
MIT Tech Review,"The Download: plastic’s problem with fuel prices, and SpaceX’s blockbuster IPO",https://www.technologyreview.com/2026/04/02/1135049/the-download-plastic-problem-fuel-prices-spacex-ipo/,"Thu, 02 Apr 2026 12:10:00 +0000",2026-04-07
MIT Tech Review,Fuel prices are soaring. Plastic could be next.,https://www.technologyreview.com/2026/04/02/1135045/plastic-economic-effects/,"Thu, 02 Apr 2026 10:00:00 +0000",2026-04-07
Wired,Nobody Knows How to File Taxes on Prediction Market Wins,https://www.wired.com/story/nobody-knows-how-to-file-taxes-on-prediction-market-wins-and-losses/,"Tue, 07 Apr 2026 09:00:00 +0000",2026-04-07
Wired,Europe Gets Serious About Age Verification Online,https://www.wired.com/story/europe-gets-serious-about-age-verification-online/,"Tue, 07 Apr 2026 06:00:00 +0000",2026-04-07
Wired,AirDoctor Coupon Codes: 40% Off | April 2026,https://www.wired.com/story/airdoctor-coupon-code/,"Tue, 07 Apr 2026 05:00:00 +0000",2026-04-07
Wired,Hoka Coupon Codes: 10% Off | April 2026,https://www.wired.com/story/hoka-coupon-code/,"Tue, 07 Apr 2026 05:00:00 +0000",2026-04-07
Wired,Bose Promo Code: 40% Off Bose for April 2026,https://www.wired.com/story/bose-coupon-code/,"Tue, 07 Apr 2026 05:00:00 +0000",2026-04-07
