source,title,link,published,collected_date
PC Gamer,"Five new Steam games you probably missed (April 7, 2026)",https://www.pcgamer.com/software/platforms/five-new-steam-games-you-probably-missed-april-7-2026/,"Tue, 07 Apr 2026 01:10:31 +0000",2026-04-07
PC Gamer,"11 years after launch, Pillars of Eternity's new turn-based mode feels like the way it's meant to be played",https://www.pcgamer.com/games/rpg/11-years-after-launch-pillars-of-eternitys-new-turn-based-mode-feels-like-the-way-its-meant-to-be-played/,"Tue, 07 Apr 2026 00:56:17 +0000",2026-04-07
PC Gamer,I watched the first TV show ever based on a game and it made me realize: we've really got it good these days,https://www.pcgamer.com/movies-tv/i-watched-the-first-tv-show-ever-based-on-a-game-and-it-made-me-realize-weve-really-got-it-good-these-days/,"Tue, 07 Apr 2026 00:54:06 +0000",2026-04-07
PC Gamer,OpenAI reportedly kicked around an 'insane' plan to pit world leaders against each other like a Call of Duty villain,https://www.pcgamer.com/software/ai/openai-reportedly-kicked-around-an-insane-plan-to-pit-world-leaders-against-each-other-like-a-call-of-duty-villain/,"Tue, 07 Apr 2026 00:51:05 +0000",2026-04-07
PC Gamer,"28 years after the final Intel 486 desktop CPUs rolled off assembly lines, Linux is finally dropping support for it",https://www.pcgamer.com/hardware/28-years-after-the-final-intel-486-desktop-cpus-rolled-off-assembly-lines-linux-is-finally-dropping-support-for-it/,"Tue, 07 Apr 2026 00:36:01 +0000",2026-04-07
IGN,Add a Cordless Electric Air Duster to Your PC Maintenance Kit for Just $24 (or Less),https://www.ign.com/articles/best-cordless-electric-air-duster-deal-april-2026,"Tue, 7 Apr 2026 02:00:00 +0000",2026-04-07
IGN,"The 24"" LG UltraGear 1080p 144Hz G-Sync Gaming Monitor Is an Outstanding Value for Under $100",https://www.ign.com/articles/lg-ultragear-27g411a-gaming-monitor-deal-april-2026,"Tue, 7 Apr 2026 00:15:00 +0000",2026-04-07
IGN,‘We Moved Away From That Baby Face’ — Overwatch Reveals Updated Look For Anran Following Fan Backlash,https://www.ign.com/articles/we-moved-away-from-that-baby-face-overwatch-reveals-updated-look-for-anran-following-fan-backlash,"Mon, 6 Apr 2026 23:38:39 +0000",2026-04-07
IGN,"High-End Gaming PCs Are More Expensive Than Ever, But You Don't Actually Need One",https://www.ign.com/articles/high-end-gaming-pcs-are-more-expensive-than-ever-but-you-dont-actually-need-one,"Mon, 6 Apr 2026 23:20:00 +0000",2026-04-07
IGN,AliExpress Has Popular Sofirn High-Powered LED Flashlights for Less Than Half of Amazon's Price,https://www.ign.com/articles/best-sofirn-led-flashlight-deals-april-2026,"Mon, 6 Apr 2026 23:15:00 +0000",2026-04-07
